{
  "schema_version": "1.1.0",

  "company_profile": {
    "company": "Rockwell Automation",
    "industry": "industrial automation",
    "size_estimate": "large, tens of thousands of employees globally",
    "business_model": "Sells industrial automation and information hardware, software, and services to manufacturers.",
    "evidence_ids": ["EV-001"]
  },

  "signals": [
    {
      "signal_id": "SIG-001",
      "description": "Public emphasis on expanding software and AI-enabled offerings within its industrial automation portfolio.",
      "category": "product",
      "evidence_ids": ["EV-002"]
    }
  ],

  "stakeholder_roles": [
    {
      "role_title": "VP Digital Transformation",
      "likely_person": null,
      "evidence_ids": []
    }
  ],

  "hypotheses": [
    {
      "hypothesis_id": "HYP-001",
      "statement": "The February 2026 emphasis on software and AI-enabled offerings suggests Rockwell is prioritizing modernization of its own product line, which may extend to advising customers on similar modernization.",
      "classification": "inference",
      "evidence_ids": ["EV-001", "EV-002"],
      "confidence": 0.55
    },
    {
      "hypothesis_id": "HYP-002",
      "statement": "Customers with a large existing installed hardware base may find it difficult to adopt newer AI-enabled software offerings without a modernization program.",
      "classification": "hypothesis",
      "evidence_ids": ["EV-003"],
      "confidence": 0.3
    }
  ],

  "evidence": [
    {
      "evidence_id": "EV-001",
      "source": "https://rockwellautomation.com",
      "source_type": "official_company_source",
      "source_date": "2026-06-01",
      "retrieval_date": "2026-07-18",
      "evidence_text": "Rockwell Automation is a global provider of industrial automation and digital transformation solutions, helping manufacturers connect people, processes, and technology to run smarter, safer, and more sustainable operations.",
      "confidence": 0.9,
      "claim_type": "fact",
      "support_type": "direct"
    },
    {
      "evidence_id": "EV-002",
      "source": "Rockwell Automation expands software and AI-enabled offerings (example fixture, not a live source)",
      "source_type": "news_publication",
      "source_date": "2026-02-10",
      "retrieval_date": "2026-07-18",
      "evidence_text": "Rockwell Automation expands software and AI-enabled offerings.",
      "confidence": 0.75,
      "claim_type": "fact",
      "support_type": "direct"
    },
    {
      "evidence_id": "EV-003",
      "source": "no specific source — general reasoning about installed-base modernization patterns",
      "source_date": "2026-01-01",
      "retrieval_date": "2026-07-18",
      "evidence_text": "Large installed hardware bases commonly slow adoption of new software layers across the industrial automation sector.",
      "confidence": 0.3,
      "claim_type": "hypothesis",
      "support_type": "unsupported",
      "staleness_justification": "General industry reasoning, not tied to a specific dated event or announcement — staleness_days doesn't apply the way it does to a discrete signal."
    }
  ],

  "outreach_drafts": [],

  "reviewer_findings": [
    {
      "finding_id": "RF-001",
      "target_id": "HYP-002",
      "verdict": "needs_revision",
      "reason": "Rests on a single unsupported evidence item — acceptable to keep as a hypothesis awaiting validation, but not yet strong enough to promote to an inference."
    }
  ],

  "approval_status": {
    "status": "draft",
    "decided_by": null,
    "decided_at": null
  }
}
